{
  "schema_version": 1,
  "company": "canon",
  "edinet_code": "E02274",
  "updated_at": "2026-10-16T17:34:11+09:00",
  "filings": [
    {
      "doc_id": "S100WH4C",
      "doc_type": "semiannual_report",
      "edinet_doc_type_code": "160",
      "fiscal_period_end": "2025-12",
      "period_type": "half",
      "period_start": "2025-01-01",
      "period_end": "2025-06-30",
      "submitted_at": "2025-08-07T15:30:00+09:00",
      "url": "https://disclosure2dl.edinet-fsa.go.jp/searchdocument/pdf/S100WH4C.pdf",
      "status": "ingested",
      "ingested_at": "2026-10-16T17:34:11+09:00"
    },
    {
      "doc_id": "S100XTLJ",
      "doc_type": "annual_report",
      "edinet_doc_type_code": "120",
      "fiscal_period_end": "2025-12",
      "period_type": "annual",
      "period_start": "2025-01-01",
      "period_end": "2025-12-31",
      "submitted_at": "2026-03-25T15:30:00+09:00",
      "url": "https://disclosure2dl.edinet-fsa.go.jp/searchdocument/pdf/S100XTLJ.pdf",
      "status": "ingested",
      "ingested_at": "2026-10-16T17:34:11+09:00"
    },
    {
      "doc_id": "S100YUDN",
      "doc_type": "semiannual_report",
      "edinet_doc_type_code": "160",
      "fiscal_period_end": "2026-12",
      "period_type": "half",
      "period_start": "2026-01-01",
      "period_end": "2026-06-30",
      "submitted_at": "2026-08-06T15:29:00+09:00",
      "url": "https://disclosure2dl.edinet-fsa.go.jp/searchdocument/pdf/S100YUDN.pdf",
      "status": "ingested",
      "ingested_at": "2026-10-16T17:34:11+09:00"
    }
  ],
  "financials": [
    {
      "fiscal_period_end": "2025-12",
      "period_type": "half",
      "period_start": "2025-01-01",
      "period_end": "2025-06-30",
      "accounting_standard": "usgaap",
      "consolidated": true,
      "doc_id": "S100WH4C",
      "net_sales_label": "売上高",
      "net_sales": {
        "value": 2198567,
        "unit": "million_yen",
        "original_unit": "yen",
        "element": "jpcrp_cor:RevenuesUSGAAPSummaryOfBusinessResults",
        "context": "CurrentYTDDuration",
        "doc_id": "S100WH4C",
        "ingested_at": "2026-10-16T17:34:11+09:00"
      },
      "operating_income": {
        "value": null,
        "unit": "million_yen",
        "original_unit": "yen",
        "element": "(not_found)",
        "context": "(not_found)",
        "doc_id": "S100WH4C",
        "ingested_at": "2026-10-16T17:34:11+09:00"
      },
      "net_income": {
        "value": 155904,
        "unit": "million_yen",
        "original_unit": "yen",
        "element": "jpcrp_cor:NetIncomeLossAttributableToOwnersOfParentUSGAAPSummaryOfBusinessResults",
        "context": "CurrentYTDDuration",
        "doc_id": "S100WH4C",
        "ingested_at": "2026-10-16T17:34:11+09:00"
      },
      "segments": [],
      "regions": []
    },
    {
      "fiscal_period_end": "2025-12",
      "period_type": "annual",
      "period_start": "2025-01-01",
      "period_end": "2025-12-31",
      "accounting_standard": "usgaap",
      "consolidated": true,
      "doc_id": "S100XTLJ",
      "net_sales_label": "売上高",
      "net_sales": {
        "value": 4624727,
        "unit": "million_yen",
        "original_unit": "yen",
        "element": "jpcrp_cor:RevenuesUSGAAPSummaryOfBusinessResults",
        "context": "CurrentYearDuration",
        "doc_id": "S100XTLJ",
        "ingested_at": "2026-10-16T17:34:11+09:00"
      },
      "operating_income": {
        "value": null,
        "unit": "million_yen",
        "original_unit": "yen",
        "element": "(not_found)",
        "context": "(not_found)",
        "doc_id": "S100XTLJ",
        "ingested_at": "2026-10-16T17:34:11+09:00"
      },
      "net_income": {
        "value": 332053,
        "unit": "million_yen",
        "original_unit": "yen",
        "element": "jpcrp_cor:NetIncomeLossAttributableToOwnersOfParentUSGAAPSummaryOfBusinessResults",
        "context": "CurrentYearDuration",
        "doc_id": "S100XTLJ",
        "ingested_at": "2026-10-16T17:34:11+09:00"
      },
      "segments": [],
      "regions": []
    },
    {
      "fiscal_period_end": "2026-12",
      "period_type": "half",
      "period_start": "2026-01-01",
      "period_end": "2026-06-30",
      "accounting_standard": "usgaap",
      "consolidated": true,
      "doc_id": "S100YUDN",
      "net_sales_label": "売上高",
      "net_sales": {
        "value": 2274542,
        "unit": "million_yen",
        "original_unit": "yen",
        "element": "jpcrp_cor:RevenuesUSGAAPSummaryOfBusinessResults",
        "context": "InterimDuration",
        "doc_id": "S100YUDN",
        "ingested_at": "2026-10-16T17:34:11+09:00"
      },
      "operating_income": {
        "value": null,
        "unit": "million_yen",
        "original_unit": "yen",
        "element": "(not_found)",
        "context": "(not_found)",
        "doc_id": "S100YUDN",
        "ingested_at": "2026-10-16T17:34:11+09:00"
      },
      "net_income": {
        "value": 171184,
        "unit": "million_yen",
        "original_unit": "yen",
        "element": "jpcrp_cor:NetIncomeLossAttributableToOwnersOfParentUSGAAPSummaryOfBusinessResults",
        "context": "InterimDuration",
        "doc_id": "S100YUDN",
        "ingested_at": "2026-10-16T17:34:11+09:00"
      },
      "segments": [],
      "regions": []
    }
  ],
  "employees": [
    {
      "fiscal_period_end": "2025-12",
      "as_of": "2025-12-31",
      "doc_id": "S100XTLJ",
      "consolidated": {
        "employees": {
          "value": 165547,
          "unit": "persons",
          "original_unit": "persons",
          "element": "jpcrp_cor:NumberOfEmployees",
          "context": "CurrentYearInstant",
          "doc_id": "S100XTLJ",
          "ingested_at": "2026-10-16T17:34:11+09:00"
        }
      },
      "non_consolidated": {
        "employees": {
          "value": 22921,
          "unit": "persons",
          "original_unit": "persons",
          "element": "jpcrp_cor:NumberOfEmployees",
          "context": "CurrentYearInstant_NonConsolidatedMember",
          "doc_id": "S100XTLJ",
          "ingested_at": "2026-10-16T17:34:11+09:00"
        },
        "average_age": {
          "value": 44.3,
          "unit": "years",
          "original_unit": "years",
          "element": "jpcrp_cor:AverageAgeYearsInformationAboutReportingCompanyInformationAboutEmployees",
          "context": "CurrentYearInstant_NonConsolidatedMember",
          "doc_id": "S100XTLJ",
          "ingested_at": "2026-10-16T17:34:11+09:00"
        },
        "average_length_of_service": {
          "value": 18.9,
          "unit": "years",
          "original_unit": "years",
          "element": "jpcrp_cor:AverageLengthOfServiceYearsInformationAboutReportingCompanyInformationAboutEmployees",
          "context": "CurrentYearInstant_NonConsolidatedMember",
          "doc_id": "S100XTLJ",
          "ingested_at": "2026-10-16T17:34:11+09:00"
        },
        "average_annual_salary": {
          "value": 8817253,
          "unit": "yen",
          "original_unit": "yen",
          "element": "jpcrp_cor:AverageAnnualSalaryInformationAboutReportingCompanyInformationAboutEmployees",
          "context": "CurrentYearInstant_NonConsolidatedMember",
          "doc_id": "S100XTLJ",
          "ingested_at": "2026-10-16T17:34:11+09:00"
        }
      }
    }
  ],
  "announcements": [],
  "revisions": []
}
